அச்சாரம்), மருந்து நிறுவனம், கிளக்சோஸ்மித்கிளைன் மற்றும் வால்டர் ரீட் ஆர்மி இன்ஸ்டிட்யூட் ஆஃப் ரிசார்ச் .
ஆகியவற்றிற்கு இடையே உள்ள கூட்டாண்மையின் மூலம் இந்த மருந்து உருவாக்கப்பட்டது.
ஒரு எளிய வகை கரிமவேதியியல் சேர்மம் ஆகும்.
சேர்ந்தவை அல்ல.
அறியப்பட்ட வேதியியல் சேர்வைகளுள் அரைப்பங்கிற்கும் மேற்பட்டவை கரிமவேதியியல் சேர்வைகள் ஆகும்.
இப்பிரிவு மக்கள் தொகை 2012 இல் 57053 ஆகக் காணப்பட்டது.
2005இன் இசைப்பயணத்திற்குப்பிறகு இவர் மிகுந்த இடைவெளி எடுத்துக்கொண்டார்.
இது அந்த ஐந்தாண்டுகளில் வெளிவந்த இவரது முதல் இசை ஆல்பமாகும்.
, Shade 45 எனும் வானொலி தடம் ஆகியவற்றைச் சொந்தமாகக் கொண்டுள்ளார்.
இவ்விருதை வென்ற முதல் ராப்  இசைக்கலைஞர் இவர் என்பது குறிப்பிடத்தக்கது.
எமினெம் ஆங்கிலம், ஜெர்மன், ஸ்காட்டிஷ், மற்றும் சுவிஸ் வம்சாவளியை சேர்ந்தவர்.
முதல் விளம்பரம் லிப்டன் பிரிஸ்க் ஐஸ் தேயிலைக்கானது.
அது டெட்ராய்ட்டில் அவர் பயணம் செய்து ஃபாக்ஸ் தியேட்டரில் ' ' இளைப்பாற்றிக் கொள்ளுங்கள் ' ' பாடல் பின்னனியில் பாடிக்கொண்டிருக்க மேடையில் ஏறுவது போன்று காட்சிப்படுத்தப்பட்டுருந்தது.
அவர் உயர்நிலை பள்ளியில் சந்தித்த கிம்பர்லி அன்னே "கிம்" ஸ்காட்டை, இரண்டு முறை திருமணம் செய்து கொண்டார்.
அவர் 2001 ஆம் ஆண்டு கிம்மை விவாகரத்து செய்தார்.
ஆனால் அவர் மீண்டும் ஏப்ரல் 2006 இல் விவாகரத்து தாக்கல் செய்ததோடு அவர்கள் இரண்டாவது திருமணம் முடிவுக்கு வந்தது.
ஐந்தாம் ஆல்பம் (இதுபரை பெயர் இல்லை) .
இதேவேளை, ஐக்கிய தேசிய கட்சியின் பிரதிநிதிகளும், ஸ்ரீலங்கா சுதந்திர கட்சியின் பிரதிநிதிகளும் இன்று சந்திப்பொன்றை நடத்தியதாக நாடாளுமன்ற உறுப்பினர் சரத் அமுனுகம தெரிவித்துள்ளார்.
இதன்படி, சபாநாயகராக கரு ஜெயசூரிய தமது பதவியை ஏற்றுக்கொண்டதுடன், நாடாளுமன்ற உறுப்பினர்கள் தமது சத்தியப்பிரமாணங்களை மேற்கொண்டனர்.
இதனைத் தொடர்ந்து, கட்சி தலைவர்கள் தங்களது கருத்துக்களை முன்வைத்தனர்.
இதனை தொடர்ந்து முன்னாள் எதிர் கட்சி தலைவர் நிமல் சிறிபாலடி சில்வா உரையாற்றினார்.
நாட்டின் தீர்க்கமான ஒரு தருணத்தில் புதிய நாடாளுமன்றம் கூடியுள்ளதாக குறிப்பிட்டார்.
கருஜயசூரியவுக்கு கட்சித் தலைவர்கள் தமது வாழ்த்தினை தெரிவித்து வருகின்றனர்.
முதலாவதாக சபாநாயகர் தெரிவு இடம்பெறவுள்ளதாக நாடாளுமன்ற பொது செயலாளர்; தம்மிக்க தசநாயக்க எமது செய்திச் சேவைக்குத் தெரிவித்தார்.
நாட்டின் பெரும்பாலான பிரதேசங்களில் களஞ்சியப்படுத்தல் பிரச்சினைகள் ஏற்பட்டன.
இதற்கு அமைச்சுக்களும், நிறுவனங்களும் உதவ வேண்டும் என்றும் அவர் கோரிக்கை விடுத்தார்.
எட்வர்ட் ஸ்னோடன் இவ்வாறு புதிய தகவலை வெளியிட்டுள்ளார்.
அமெரிக்க பாதுகாப்பு ரகசியங்களை வெளியிட்டதாக குற்றம்சாட்டப்பட்டவர் எட்வர்ட் ஸ்னோடன், அமெரிக்காவின் நடவடிக்கைக்கு அஞ்சி 2013ஆம் ஆண்டு அங்கிருந்து வெளியேறினார்.
குறித்த தடையை எதிர்வரும் ஒக்டோபர் மாதம் 13 ஆம் திகதி வரை நீடித்து மேன்முறையீட்டு நீதிமன்றம் உத்தரவிட்டிருந்தது.
நாளை வரை அமுலில் இருந்த தடையுத்தரவு இன்று இடம்பெற்ற விசாரணையின் பின்னர் நீடிக்கப்பட்டது.
8 வது நாடாளுமன்றத்தின் முதலாவது உரையை நிகழ்த்திய போதே அவர் இதனை குறிப்பிட்டுள்ளார்.
தேசிய பாதுகாப்பு மற்றும் இறைமை தொடர்பான பூரண பொறுப்பை தாம் ஏற்றுக் கொள்வதாகவும் அவர் சுட்டிக்காட்டியுள்ளார்.
சகல மக்களுக்கிடையேயும் நல்லிணக்கணத்தை ஏற்படுத்திய வேண்டியது அவசியம் என்றும் ஜனாதிபதி மைத்திரிபால சிறிசேன தெரிவித்துள்ளார்.
இந்த காணொளி தற்போது இணையத்தளங்களில் வெளியாகியுள்ளது.
இந்த கடிதத்தில் ஐக்கிய மக்கள் சுதந்திர கூட்டமைப்பின் 56 உறுப்பினர்கள் கையெழுத்திட்டுள்ளனர்.
செய்மதி ஊடாக பெறப்பட்ட புகைப்படங்கள் இதனை உறுதிப் படுத்துவதாக குறிப்பிடப்பட்டுள்ளது.
இதனையடுத்து வனவிலங்கு திணைக்கள அதிகாரிகள் மற்றும் குற்றத்தடுப்பு விசாரணை திணைக்கள அதிகாரிகள் இது தொடர்பான நீதிமன்ற உத்தரவு ஒன்றை பெற்று கொண்டு யானைகளை பின்னவல சரணாலயத்திடம் ஒப்படைத்தனர்.
அதற்கு பதிலளித்த அவர், அலி ரொசானுக்கு சொந்தமானதென  கருதப்படும் மேலும் மூன்று யானைகளை தேடி விசாரணைகள் முன் எடுக்கப்படுவதாக குறிப்பிட்டார்.
அங்கு வரும் மக்கள் ஏமாற்றப்படுகின்றமை இதன் மூலம் வெளியாகியுள்ளது.
இந்திய ஊடகமொன்றுக்கு வழங்கிய செவ்வியொன்றின் போதே அவர் இதனைத் தெரிவித்திருந்தார்.
இலங்கையில் இடம்பெற்ற இறுதி யுத்த த்தில் இந்தியா இலங்கைக்கு உதவியதாகவும் , நான் ஒரு போதும் எல்.டீ.டீ. ஈ இயக்கத்தை காட்டிக்கொடுக்கவில்லை.
இலங்கை இரா­ணு­வத்­திடம் உயி­ரோடு பிடி­ப­டு­வதை பிர­பா­கரன் விரும்­ப­மாட்டார்.
இந்த நிலையில் கடந்த பொதுத் தேர்தலில் அதிக ஆசனங்களை பெற்று வெற்றி பெற்ற மூன்றாவது கட்சி அடிப்படையில் தமிழ் தேசிய கூட்டமைப்பு தனித்தக் கட்சியாக நாடாளுமன்றத்தில் விளங்குகிறது.
சுத்திகரிப்பு நிலையத்திற்கு செல்லும் நீரில் இரண்டு தடவைகள் எண்ணெய் கலந்திருந்தமை பாரிய தாக்கத்தை ஏற்படுத்தியுள்ளது.
களனி கங்கையின் எல்லையில் உள்ள 27 ஏக்கர் நிலப்பரப்பில் ராஜசிங்க எனும் பிரதேசத்தில் அம்பத்தளை குடிநீர் சுத்திகரிப்பு நிலையம் அமைந்துள்ளது.
கொழும்பில் 80 சதவீதத்திற்கும் அதிகமாக மக்கள் அங்கிருந்து நீரை பெறுகின்றனர்.
இந்தநிலையில், குறித்த பிரதேசத்தில் அமைந்துள்ள சில தொழிற்சாலைகள் காரணமாக குடிநீரில் கழிவு எண்ணெய் கலந்துள்ளதாக அம்பத்தளை நீர் சுத்திகரிப்பு நிலையத்தின் பிரதி முகாமையாளர் சீ.ஆர்.பெரேரா தெரிவித்தார்.
இவ்வாறான செயற்பாடுகளின் ஊடாக ராணுவ அதிகாரிகளின் மனநிலையில் பின்னடைவு ஏற்படும் என அவர் சுட்டிக்காட்டியுள்ளார்.
ஊடகவியலாளர் பிரகீத் மற்றும் தமிழீழ விடுதலைப்புலிகளுக்கு இடையில் இருந்ததாக கூறப்படும் தொடர்புகள் பற்றியும் அவர் விபரித்தார்.
உயிரிழந்த சிறைக்கைதி 20 வயது மதிக்கத்தக்கவர் எனவும், போதைப்பொருளை தம்வசம் வைத்திருந்த குற்றச்சாட்டில் கைது செய்யப்பட்டவர் எனவும் சிறைச்சாலை திணைக்களம் தெரிவித்துள்ளது.
பெரும்பாலான சிறைக்கைதிகள் போதைப்பொருளுக்கு அடிமையாகியுள்ளனர்.
புதிய அமைச்சரவையில், 45 அமைச்சர்கள் அங்கத்துவம் வகிப்பர் என்றும் அவர் குறிப்பிட்டார்.
இந்த நிலையில், ராஜாங்க மற்றும் பிரதி அமைச்சர்கள் பதவிப்பிரமாணம் செய்து கொள்ளும் தினம் குறித்து இது வரையில் தீர்மானிக்கப்படவில்லை.
அதன் எண்ணிக்கை மற்றும் கட்சிகளுக்கான அமைச்சு பதவிகள் குறித்து தற்போது பேச்சுவார்த்தைகள் இடம்பெற்று வருவதாகவும் ரவி கருணாநாயக்க தெரிவித்தார்.
இரண்டு பிரதான கட்சிகள் தேசிய அரசாங்க கட்டமைப்பில் இணைந்து செயற்படகின்றன.
தேசிய அரசாங்கத்தின் ஒன்றிணைந்துள்ள ஜனாதிபதி மைத்திரிபால சிறிசேன மற்றும் பிரதமர் ரணில் விக்கிரமசிங்க ஆகியோர் நாடாளுமன்ற வரைமுறைகளை மிக நேர்த்தியாக பின்பற்றுவார்கள் எனவும் அவர் நம்பிக்கை வெளியிட்டுள்ளார்.
அவர் வேறு பிக்குகளுடன் சுற்றுலாவொன்றுக்கு சென்றவேளையிலேயே இச்சம்பவம் இடம்பெற்றுள்ளதாக தெரிவிக்கப்படுகின்றது.
ஒரு முறையற்ற பந்து வீச்சினையடுத்து சில தருணங்களில் பந்து நடுவரை நோக்கி பயணிக்கும் போது  நடுவர் தன்னை பாதுகாத்து, பின்வாங்குவதற்கு உரிய கால அவகாசம் கிடைக்கும் என அவர் சுட்டிக்காட்டியுள்ளார்.
எம்.சி.சி. கிரிக்கட்டில் அவர் உரையாற்றிய போது இதனை குறிப்பிட்டார்.
லெஸ்பொஸ் தீவில் இருந்தே இவ்வாறு குடியேற்ற வாசிகள் இடம்பெயர்ந்துள்ளதாக தகவல்கள் தெரிவிக்கின்றன.
சுமார் 4 ஆயிரத்து 200 பேர் இவ்வாறு இரண்டு கப்பல்களில் நேற்று இரவு சென்றுள்ளனர்.
பெரும்பாலும், மத்திய கிழக்கு நாடுகளில் இருந்தே ஆயிரக்காணக்காவர்கள் இடம்பெயர்வதாக தெரிவிக்கப்படுகிறது.
ஸ்ரீ லங்கா சுதந்திர கட்சியின் 64வது வருடாந்த மாநாட்டில் கலந்து கொண்டு உரையாற்றிய போதே அவர் இதனை குறிப்பிட்டார்.
இதன்போது, தொடர்ந்தும் உரையாற்றிய ஜனாதிபதி மைத்திரிபால சிறிசேன, ஜனநாயக நாடொன்றில் அரசாங்கம் ஒன்று மாற்றமடைவது வியப்புக்குரிய விடயமல்லவென குறிப்பிட்டார்.
தற்கொலை செய்து கொண்ட இடத்தில்  இஷாவின் கைப்பைக்குள், போதை மாத்திரை, 250 கிராம் கஞ்சா இருந்ததை பொலிஸார் பறிமுதல் செய்துள்ளனர்.
லஞ்ச ஆணைக்குழு கட்டிடத்தின் இட வசதிகள் தொடர்பில் ஆராய்வதற்காகவே இந்த விஜயம் அமைந்துள்ளதாக தகவல்கள் தெரிவிக்கின்றன.
போர்க்குற்றங்கள் குறித்து உள்நாட்டு பொறிமுறை ஒன்றை அமைப்பது குறித்த செய்திகள் வெளியாகி இருக்கின்றன.
இது தொடர்பில் இப்போதைக்கு எதனையும் கூற முடியாது என்று அவர் கூறியுள்ளார்.
2010 ஆம் ஆண்டு ப்ரகீத் எக்னெலிகொட காணாமல் போக செய்யப்பட்டமை தொடர்பில் இராணுவ புலனாய்வாளர்கள் மூவர் அண்மையில் விசாரணை செய்யப்பட்டனர்.
இதில் ப்ரகீத் தவறு ஏதும் இழைந்திருந்தால் அது நீதிமன்றத்திற்கு கொண்டு செல்லப்பட்டிருக்க வேண்டும்.
அந்த அதிகாரம் இராணுவத்திற்கு வழங்கப்படவில்லை என சமன் ரத்னப்ரிய குறிப்பிட்டார்.
உயர் நீதிமன்றம் இந்த தடையை விதித்துள்ளது.
இரண்டாம் உலக போர் வெற்றி தொடர்பான அணிவகுப்புகளை சீனா நடத்தியுள்ளது.
தென் சீனக்கடல் மற்றும் கிழக்கு சீனக் கடல் உள்ளிட்ட பகுதிகளில் சீனா பிராந்திய ரீதியான தளம்பல் நிலைகளை கொண்டுள்ளது.
அதேநேரம், அலஸ்கா கடற்பரப்பில் சீனாவின் ஐந்து யுத்தக் கப்பல்களை அவதானித்ததாக அமெரிக்கா தெரிவித்துள்ளது.
முன்னாள் கணக்காய்வாளரான அவர், ஜே.வி.பியின் தேசிய பட்டியல் ஊடாக அவர் நாடாளுமன்றத்துக்கு தெரிவாகி இருந்தார்.
எனினும் கடந்த பொதுத் தேர்தலில் ஜே.வி.பிக்கு பொது மக்கள் குறைந்த அளவான ஆதரவையே வெளிப்படுத்தி இருந்தனர்.
இதேவேளை, கே.டி.லால்காந்தவுக்கு இந்த பதவியை வழங்குவதற்காகவே அவர் பதவி விலகியதாக தகவல்கள் வெளியாகி இருந்தன.
அவர்களை குடியேற்றுவதற்கான நடவடிக்கைகள் எடுக்கப்பட வேண்டியது கட்டாயமானது என்று அந்த நிறுவனங்கள் வலியுறுத்தியுள்ளன.
இதன்போது  கருத்து தெரிவித்த சபாநாயகர் கடிதம் தமக்கு கிடைக்கவில்லையென தெரிவித்தார்.
எதிர்க்கட்சித் தலைவர் பதவியை தானும் தனது கட்சியும் ஏற்றுக்கொள்வதாக ஆர். சம்பந்தன் சற்று முன்னர் பாராளுமன்றத்தில் தெரிவித்தார்.
சபாநாயகர் மற்றும் தமக்கு வாக்களித்த மக்களுக்கும் அவர் இதன்போது நன்றி தெரிவித்தார்.
எனினும் அவர் அதியுயர் கதிர்வீச்சைக் கொண்ட அனலியம் விசம் ஏற்றி கொலை செய்யப்பட்டதாக அவரது மனைவி தெரிவித்திருந்தார்.
கொழும்பில் இடம்பெற்ற செய்தியாளர் சந்திப்பில் வைத்து அவர் இதனைக் கூறியுள்ளார்.
இதன்படி அமைச்சரவையில் 48 அமைச்சர்கள் உள்ளடங்குவர்.
எனினும், தற்போது உருவாக்கப்பட்டுள்ள தேசிய அரசாங்கம் இல்லை என்றும், அதனால் அமைச்சர்களின் எண்ணிக்கையை 30க்கு மேல் அதிகரிக்க முடியாது என்றும் ஜே வி பியின் நாடாளுமன்ற உறுப்பினர் அனுரகுமார திஸாநாயக்க வாதிட்டார்.
நாடாளுமன்றத்தின் அனைத்து கட்சிகளும் சம்மந்தப்படாததால், தற்போது உருவாக்கப்பட்டுள்ள அரசாங்கம் தேசிய அரசாங்கம் இல்லை என்று தெரிவித்தார்.
இதனை அடுத்து எழுந்த முன்னாள் எதிர்கட்சித் தலைவர் நிமால் சிறிபாலடி சில்வா, தற்போது உருவாக்கப்பட்டுள்ளது தேசிய அரசாங்கம் என்பதை உறுதிப்படுத்தும் வகையில் வாதிட்டதுடன், புதிய எதிர்கட்சித் தலைவர் இரா.சம்பந்தனும் அது சார்ந்த கருத்தை முன்வைத்தார்.
பிரதமரின் யோசனைக்கு எதிராக நாடாளுமன்ற உறுப்பினர்களான தினேஸ்குணவர்தன, வாசுதேவநாணயக்கார மற்றும் விமல் வீரவன்ச ஆகியோர் பல்வேறு கருத்துக்களை முன்வைத்தனர்.
அமைச்சரவையின் அமைச்சர்களின் எண்ணிக்கையை அதிகரிப்பதை ஏற்றுக்கொள்ள முடியாதென அவர் சுட்டிக்காட்டியிருந்தார்.
