நேற்றுக் காலை பிரதி அமைச்சர் காதர் மஸ்தான், பாராளுமன்ற உறுப்பினர் சார்ள்ஸ் நிர்மலநாதன் ஆகியோர் நேரில் சென்று பாதிக்கப்பட்ட இடங்களை பார்வையிட்டனர்.
சூத்திரதாரிகளை கைதுசெய்வதற்கு விரைந்து நடவடிக்கை எடுக்க வேண்டும் என அவர்கள் பொலிஸாருக்குப் பணிப்புரை விடுத்திருந்தனர்.
இதேவேளை, நாயாறு பகுதியில் மீனவர்களின் வாடிகள் மற்றும் படகுகள் விஷமிகளால் தீவைக்கப்பட்ட சம்பவத்தை நல்லிணக்கம், சகவாழ்வு மற்றும் அரசகரும மொழிகள் அமைச்சர் மனோ கணேசன் நேற்று ஜனாதிபதியின் கவனத்துக்குக் கொண்டுவந்தார்.
ஜனாதிபதி மைத்திரிபால சிறிசேன தலைமையில் நேற்று நடைபெற்ற அமைச்சரவைக் கூட்டத்தில் அமைச்சர் மனோ கணேசன் இந்த விவகாரத்தை எழுப்பியிருந்தார்.
முல்லைத்தீவு கடற்பரப்பில் வெளிமாவட்ட மீனவர்கள் தங்கியிருந்து சட்டவிரோதமான மீன்பிடியில் ஈடுபட்டு வருவதாக அப்பகுதி மீனவர்கள் தொடர்ச்சியாக எதிர்ப்புக்களை வெளியிட்டு வருகின்றனர்.
சுவாரஷ்யமான தன்னுடைய படைப்புக்களின் மூலம் தமிழ்ச் சூழலின் தனக்கான பரப்பினை மிக விசாலமாக விரித்துக் கொண்டவர்.
அவற்றின் மீதான உரையாடல்கள் பெரும் பரப்பினை தோற்றுவிக்கக் கூடியவை.
இந்த தாக்குதலில் 18 ஈரான் மற்றும் ஈரான் ஆதரவு போராளிகள் கொல்லப்பட்டதாக பிரிட்டனை தளமாகக் கொண்டு செயற்படும் மனித உரிமைகளுக்கான சிரிய கண்காணிப்பகம் குறிப்பிட்டுள்ளது.
நகரெங்கும் இருந்து 24 சக்திவாய்ந்த வெடிப்புச் சத்தங்கள் கேட்டதாக அங்கிருந்து வரும் செய்திகள் கூறுகின்றன.
எனினும் அவை இஸ்ரேலிய நிலப்பகுதியை தாக்க தவறியதாக இஸ்ரேலிய இராணுவம் குறிப்பிட்டுள்ளது.
மனிதன் நிம்மதியைச் தேடிச் செல்கின்ற ஒரு இடமாக மதஸ்தலம் உள்ளது.
இலங்கையில் முப்பது வருட காலமாக நிலவிய யுத்தம் முடிவுக்கு கொண்டுவரப்பட்டு சுமார் பத்து வருடங்கள் கடந்த நிலையில், இப்போது உருவெடுத்த இந்த பயங்கரவாதம் தேசிய நெருக்கடியைத் தோற்றுவித்துள்ளது.
இந்த தாக்குதலானது மத அடிப்படைவாதிகளினால் மேற்கொள்ளப்பட்டுள்ளது.
இவ்வுலகில் சகல மனித உயிர்களும் நிம்மதியாக தத்தமது மதம் ஏற்றுக் கொண்டுள்ள கொள்கைகளை பின்பற்றி வாழ விரும்புகின்றன.
பயங்கரவாத அமைப்புகளின் பட்டியலில் உள்ள பயங்கரவாதக் குழுக்கள் உலகளாவிய ரீதியில் பயங்கரவாத முத்திரை குத்தப்பட்டுள்ளன.
இஸ்லாமிய பயங்கரவாத இயக்கத்துடன் தொடர்புடைய தீவிரவாதிகளில் சிலர் மேற்கு நாடுகளில் கல்வி கற்றுள்ளனர்.
இங்கு மனித வெடிகுண்டுகளாக தாக்குதலில் ஈடுபட்டவர்கள் சிலர் வெளிநாடுகளில் கற்றுள்ளனர்.
தங்களது மத்ரஸா கல்வியினை இடைநடுவே விட்டிருக்கின்றனர்.
இவர்கள் 30 இற்கும் 40 இற்கும் இடைப்பட்ட வயதுடையவர்கள்.
இவர்கள் தங்களுடைய இலக்கை அடைவதற்காக மற்றைய இனத்தவரைக் கூட பயன்படுத்தக் கூடிய அபாயம் உள்ளது.
எனினும் தவிர்க்க முடியாத காரணத்தால் இது பிற்போடப்பட்டுள்ளது.
நாம் தமிழர் கட்சி மற்றும் மகராஷ்டிரா மாநிலத்தைச் சேர்ந்த கலை இலக்கியப் பண்பாட்டுப் பாசறை சார்பாக `இன எழுச்சி முழக்கம்’ பாடல் குறுந்தகடு வெளியீட்டு விழா சென்னை வடபழனியில் நேற்று நடைபெற்றது.
இந்த நிகழ்ச்சியில் இயக்குநர் வெற்றிமாறன் உள்ளிட்ட திரைப் பிரபலங்களும் கலந்துகொண்டனர்.
நல்லகண்ணுவைத் தாண்டிய ஒரு தலைவன் இந்தியாவிலேயே உண்டா?’’ என்று பேசினார்.
சர்கார் பட விவகாரத்தில் விஜய் உறுதியாக நின்றிருக்கலாம் என்று கூறிய சீமான், `என் படத்தில் அவர் நடிக்க மாட்டாரு.
முன்னாள் ஜனாதிபதி மஹிந்த ராஜபக்ஷவிற்கு வழங்கப்பட்டிருந்த 45 பாதுகாப்பு படையினர் நீக்கப்பட்டுள்ளனர்.
சுமந்திரன் எம். பி.க்கு புலிகளின் அச்சுறுத்தல் இருப்பதாகக் கூறப்பட்டது.
மஹிந்த ராஜபக்ஷவுக்கு பல ஆயிரம் மடங்கு புலிகளின் அச்சுறுத்தல் இருக்கிறது.
விமல் வீரவன்ச பிணை கோரி தாக்கல் செய்திருந்த மனுவுக்கு எதிர்ப்புகள் இருக்குமாயின் அதை அன்றையதினம் தெரிவிக்குமாறும் நீதிமன்றம் உத்தரவிட்டுள்ளது.
எனினும், பிணைக்கு எதிர்ப்புத் தெரிவிப்பது பற்றி அறிவிப்பதற்கான திகதியை மாத்திரம் கொழும்பு உயர்நீதிமன்ற நீதிபதி வீ.களுவாராச்சி அறிவித்தார்.
2014 ஆம் ஆண்டு தும்பு உற்பத்திப் பொருட்கள் ஏற்றுமதியினால் 4 பில்லியன் ரூபா வருமானம் கிடைத்ததாகவும் 2018 ஆம் ஆண்டில் அது 10 பில்லியனாக உயர்வடைந்ததாகவும் அவர் மேலும் தெரிவித்தார்.
அரச மருந்தாக்கல் கூட்டுத்தாபனத் தலைவராக செயலாற்றிய ரூமி மொஹமட், மருந்துகளை இறக்குமதி செய்யும் போதும் அதனை பகிர்ந்தளிக்கும் போதும் ஊழல் - மோசடிகளில் ஈடுபட்டுள்ளார் என்றும் அரச நிதியை முறைக்கேடாக பயன்படுத்தியுள்ளார் என்றும் அவர் வெளிநாட்டுக்கு தப்பிச்செல்ல முற்பட்டார் என்றும் ஊடகங்களில் செய்திகள் வெளியாகியுள்ளன.
காலி மாவட்ட பாராளுமன்ற உறுப்பினர் வஜிர அபேகுணவர்தனவும் புத்தளம் மாவட்ட பாராளுமன்ற உறுபபினர் பாலித ரங்கே பண்டாரவும் யானைச் சின்னத்திலேயே, கூட்டணி போட்டியிட  தேர்தலில் போட்டியிடுவதற்கான வியூகங்களை வகுத்தல் தொடர்பில் முக்கிய அவதானம் செலுத்தப்பட்டது.கூட்டணியின் உறுப்பினர்கள் இதுகுறித்த தமது நிலைப்பாட்டை வெளிப்படுத்தினர்.
அரசியல் யாப்பு உருவாக்கம் தொடர்பாக கேள்வி எழுப்பிய போதே அவர் இவ்வாறு தெரிவித்தார்.
தமிழ் மக்களின் பிரச்சினைகளை நிறைவேற்ற வேண்டுமென்ற எண்ணமும், கடப்பாடும் அரசாங்கத்திற்கு உள்ளதா? என்பதே இங்கு கேள்விக்குறியாக உள்ளது.
இவ் இலவச வைத்திய முகாமின் மூலம் இப்பிரதேசத்திலுள்ள அதிகமானோர் பயன்பெற்றதாக கிராமவாசிகள் தெரிவிக்கின்றனர்.
தொடர் சிகிச்சை பெற தேவையுடைய நோயாளர்களை பாணந்துறை ஆதார வைத்தியசாலையில் நடைபெறும் வாராந்த சிகிச்சை கிளினிக் செல்ல வசதிகள் செய்து கொடுக்கப்பட்டமை விசேட அம்சமாகும்.
கடந்த இரண்டு தசாப்தங்களாக எவரெஸ்ட் மலை ஏறுவோருக்கு வழிகாட்டியாக இருக்கும் கமி ரிடா செர்ப்பா, தனது தொழிலாக 8,848 மீற்றர் உயரத்தை ஏறி வருகிறார்.
ஆனால் ஒரு வழிகாட்டியாக 22 ஆவது முறையாக ஏறவுள்ளேன்.
அண்மையில் நடந்த ஜனாதிபதி தேர்தலில் மொராலஸ் வெற்றி பெற்றபோதும் அவர் மோசடியில் ஈடுபட்டதாக குற்றம்சாட்டி பல வாரங்கள் ஆர்ப்பாட்டங்கள் நீடித்த நிலையிலேயே அவர் பதவியை இராஜினாமா செய்தார்.
இடைக்கால ஜனாதிபதியாக அனேசின் நியமனத்திற்கு பொலிவிய அரசியலமைப்பு நீதிமன்றம் ஒப்புதல் அளித்தது.
இந்நிலையில் அனேசின் நியமனத்திற்கு எதிராக தலைநகர் லா பாஸில் உள்ள ஜனாதிபதி மாளிகைக்கு பேரணியாகச் சென்ற மொராலஸ் ஆதரவாளர்களை கலைக்க கலகமடக்கும் பொலிஸார் கண்ணீர் புகைப்பிரயோகம் மேற்கொண்டனர்.
ஆனால், பெரும் சேதங்கள் ஏதும் ஏற்படவில்லை என பொலிஸார் தெரிவித்தனர்.
ஆகவே இது தொடர்பாக கூடுதல் கவனம் செலுத்துவதாகவும் தெரிவித்தார்.
ஜெயலலிதா ரூ.100 கோடியும், மற்றவர்கள் தலா ரூ.10 கோடியும் அபராதம் செலுத்த வேண்டும் என்று கர்நாடக சிறப்பு நீதிமன்ற நீதிபதி மைக்கேல் டி குன்ஹா கடந்த 2014-ம் ஆண்டு தீர்ப்பளித்தார்.
அதில் வழக்கு மற்றும் உச்ச நீதிமன்றத்தின் உத்தரவு தொடர்பான விவரங்கள் குறிப்பிடப்பட்டு இருந்தன.
அதன்பின் வழக்கமான நடைமுறைப்படி அந்த சொத்துகள் கையகப்படுத்தப்படும்.
தமிழக லஞ்சம் மற்றும் ஊழல் தடுப்பு பிரிவு இணை இயக்குநராக இருக்கும் வெங்கட்ராமன்தான் ஜெயலலிதாவின் சொத்துக்குவிப்பு வழக்கை கவனித்து வருகிறார்.
இதுவரை அவரை 3 முறை சந்தித்து பேசும் வாய்ப்பு கிடைத்தது.
அரசியலில் அவர் எனக்கு உந்து சக்தியாக உள்ளார்.
நான் தந்தை கட்சியில் சேர்ந்து அரசியலுக்கு வர மாட்டேன்.
எந்த கட்சியில் சேருவேன் என்பதை பிறகு தெரிவிக்கிறேன்’
பிரான்ஸ் பொலிஸார் இதனைத் தெரிவித்தனர்.
அதே வேளையில் ஆர்ப்பாட்டக்காரர்களில் சிலர் போத்தல்களையும் இதர பொருட்களையும் பொலிஸார் மீது வீசி எறிந்ததாகவும், வாகனங்கள், வீதித் தடுப்புகள், குப்பைத் தொட்டிகள் ஆகியவற்றுக்குத் தீ மூட்டியதாகவும் அதிகாரிகள் கூறினர்.
இதில், ஆண்கள் ஒற்றையர் பிரிவில் நடப்பு சம்பியனான நோவக் ஜோகோவிச் (செர்பியா), முதல் சுற்றில் ஸ்பெயின் வீரர் பெர்னாண்டோ வெர்டாஸ்கோவை எதிர்கொண்டார்.
23 ஆண்டுகளுக்கு பின் ‘கை’ ஓங்குமா? என்பதை பொறுத்திருந்து பார்ப்போம்.
தி.மு.க. கூட்டணியில் இடம் பெற்ற தேசிய கட்சியான காங்கிரசுக்கு தமிழகத்தில் ஒதுக்கப்பட்ட 9 தொகுதிகளில் திருச்சி நாடாளுமன்ற தொகுதியும் ஒன்றாகும்.
காங்கிரஸ் கட்சி சார்பில் நாடாளுமன்ற தேர்தலில் முதன் முதலாக திருச்சி தொகுதியில் அவர் களம் இறக்கப்பட்டுள்ளார்.
காங்கிரசாரில் பலர் ஜோசப் லூயிஸ்தான் வேட்பாளர் என பேசப்பட்டு வந்த நிலையில் திருநாவுக்கரசருக்கு கொடுக்கப்பட்டுள்ளது.
திருச்சி நாடாளுமன்ற தொகுதியில் திருச்சி மேற்கு, திருச்சி கிழக்கு, ஸ்ரீரங்கம், திருவெறும்பூர், புதுக்கோட்டை மாவட்டத்தில் உள்ள புதுக்கோட்டை, கந்தர்வகோட்டை ஆகிய 6 சட்டமன்ற தொகுதிகளை உள்ளடக்கியது.
திருச்சி நாடாளுமன்ற தொகுதியை பொறுத்தவரை தி.மு.க., அ.தி.மு.க., ம.தி.மு.க., கம்யூனிஸ்ட், பாரதீய ஜனதா என பல்வேறு கட்சிகள் களம் கண்டு வென்றுள்ளன.
இதுவரை நடந்த தேர்தல்களில் தி.மு.க. ஒருமுறை மட்டுமே வென்றுள்ளது.
கடைசியாக 2009-ம் ஆண்டு முதல் தொடர்ந்து 10 ஆண்டுகளாக திருச்சி நாடாளுமன்ற தொகுதியை அ.தி.மு.க. தன் வசம் வைத்திருந்தது.
தற்போது அ.தி.மு.க. கூட்டணியில் இடம்பெற்ற தே.மு.தி.க.வுக்கு திருச்சி தொகுதி ஒதுக்கப்பட்டுள்ளது.
தொடர்ந்து திருச்சி தொகுதியில் கம்யூனிஸ்ட் கட்சிகளே வென்று வந்தன.
கிட்டத்தட்ட 23 ஆண்டுகளுக்கு பின் மீண்டும் காங்கிரஸ் கட்சி திருச்சி தொகுதியில் களம் காண்கிறது.
திருநாவுக்கரசர் ‘கை’ ஓங்குமா? என்பது அவரது தேர்தல் பிரசார யுக்தியை பொறுத்தே அமையும்.
புதுக்கோட்டை மாவட்டம் தீயத்தூர் என்ற கிராமத்தை சேர்ந்தவர்.
அ.தி.மு.க.வில் 1977-ம் ஆண்டு முதல் 1991 வரை இருந்து பல்வேறு பொறுப்புகளை வகித்தவர்.
மீண்டும் 1996-ம் ஆண்டு முதல் 2000-ம் ஆண்டுவரை அ.தி.மு.கவில் இணைந்து பணியாற்றினார்.
தேர்தல் குழு பணி அவருக்கு ஒதுக்கப்பட்டது.
வட ஆபிரிக்காவிலிருந்து வீசும் அனல் காற்று, ஐரோப்பாவில் வெப்பநிலை அதிகரிப்பதற்குக் காரணமாக உள்ளது.
அனைவரும் பகிர்ந்து கொள்ளுமாறு கூறினார்.
அத்தினாபுரம் திரும்பிச் சென்ற துரியோதனன், தானும் ஒரு சபா மண்டபத்தைக் கட்டினான்.
பாஞ்சாலியின் சபதத்தைக் கேட்டு துரியோதனன், துச்சாதனன்  மற்றும் அத்தினாபுர அவையினர் அதிர்ந்தனர்.
திரௌபதி அம்மனுக்கு தனிக் கோயில்கள் உள்ளன.
5/188 (24.3 நிறைவுகள்) .
3/37 (6.4 நிறைவுகள்) .
3/22 (5 நிறைவுகள்) .
மழையினால் தென்னாபிரிக்காவிற்கு இலக்கு 188 ஆகவும் நிறைவுகள் 25 ஆகவும் குறைக்கப்பட்டது.
2/28 (5 நிறைவுகள்) .
122 (29.3 நிறைவுகள்) .
1/125 (22.5 நிறைவுகள்) .
1/31 (5 நிறைவுகள்) .
2/41 (7 நிறைவுகள்) .
296/6 (50 நிறைவுகள்) .
மாக்சு சொரென்சென் 3/55 (10 நிறைவுகள்) .
அலசுடயர் எனான்சு 4/17 (5 நிறைவுகள்) .
364/5 (50 நிறைவுகள்) .
211/8 (50 நிறைவுகள்) .
1/49 (8 நிறைவுகள்) .
2/38 (10 நிறைவுகள்) .
331/8 (50 நிறைவுகள்) .
197 (44.2 நிறைவுகள்) .
2/35 (6 நிறைவுகள்) .
279/8 (50 நிறைவுகள்) .
281/3 (45.2 நிறைவுகள்) .
3/35 (10 நிறைவுகள்) .
1/23 (5 நிறைவுகள்) .
304/8 (50 நிறைவுகள்) .
கிருஷ்ணா சந்திரன் 3/50 (9 நிறைவுகள்) .
ஆட்சி மொழி(கள்) .
நீர் (%) .
"Global and regional drivers of accelerating CO .
The environment: a revolution in attitudes .
ice core record and its relationship with .
சமுதாய நெறிகள் மற்றும் சமூக எதிர்பார்ப்புகளை அடிப்படையாகக் கொண்டு இந்த நடத்தைகள் மற்றும் திறன்கள் மாறுபடுகின்றன.
உதாரணமாக, முடிவெடுப்பது பெரும்பாலும் விமர்சன சிந்தனை ("என் விருப்பத்தேர்வுகள் என்ன?") மற்றும் மதிப்புகள் ("எனக்கு என்ன முக்கியம்?"), (நான் இதை எப்படி உணர்கிறேன்?
கலாச்சாரத்திற்கு கலச்சாரம் மற்றும் வாழ்க்கை நிலைகளுக்கு ஏற்ப நெகிழ்ந்து கொடுக்கும் பண்பை இது பெற்றுள்ளதே இதற்கான காரணமாகும்.
பயம், கோபம், மன அழுத்தம் ஆகியவற்றை புறந்தள்ளவும், மனிதன்  ஒரு தரமான வாழ்க்கையை அடையவும் நகைச்சுவை உணர்வு அனுமதிக்கிறது .
