தம்மை நிரந்தரமாக பதிவுசெய்யுமாறு மேன்பவர் பணியார்கள் கோருகின்றபோதும், அவர்களை நிரந்தரமாக பதிவுசெய்ய முடியாத நிலைமை காணப்படுகிறது.
இதனால் இருவரும் காயமடைந்து மருத்துவமனையில் அனுமதிக்கப்பட்டுள்ளனர்.
நேற்று இரவு குடிபோதையில் இருந்த இந்த இரண்டு சகோதரர்களுக்கும் இடையே ஏற்பட்ட வாய்த் தகராறு அதிகாரித்து ஒருவர் கூரியு ஆயுதத்தாலும், மற்றைய நபர் தடியாலும் ஒருவரை ஒருவர் தாக்கி கொண்டுள்ளனர்.
இதில், வாநூர்தி தாங்கி கடற்படை கப்பல் உட்பட யுத்த கப்பல்கள் உள்ளடங்குவதாக தெரிவிக்கப்பட்டுள்ளது.
பிராந்தியத்தில் ஏற்படும் எந்தவிதமான அச்சுறுத்தலையும் முகம் கொடுக்கும் நோக்கிலேயே இந்த நடவடிக்கை மேற்கொள்ளப்பட்டுள்ளதாக அமெரிக்க இராணுவம் குறிப்பிட்டுள்ளது.
வட கொரியாவின் அணு ஆயுத அச்சுறுத்தலை அமெரிக்காவினால் தனியாக எதிர்கொள்ள முடியும் என அமெரிக்க ஜனாதிபதி டொனால்ட் ட்ரம்ப் தெரிவித்துள்ளார்.
இதேவேளை, இந்த வருடத்தின் முதல் 3 மாதங்களுக்குள் டெங்கு நோயினால் பாதிக்கப்பட்ட சுமார் 30 ஆயிரத்து 486 பேர் இனங்காணப்பட்டுள்ளதாக சுகாதார அமைச்சின் தொற்று நோய் பிரிவு தெரிவித்துள்ளது.
கொழும்பில் இருந்து சீகிரிய நோக்கி பயணித்த போது இவ்வாறு விபத்திற்கு உள்ளாகி காயமடைந்துள்ள 3 வெளிநாட்டவர்களும் லிதுவேனியா நாட்டைச் சேர்ந்தவர்கள் என தெரியவந்துள்ளது.
அவர்கள் தற்போது கலேவெல மருத்துவமனையில் சிகிச்சை பெற்று வருகின்றனர்.
தான் பிச்சை எடுப்பதை தினம் தினம் பார்த்து மனதுக்குள் தனது மகள் கஷ்டப்படுவதை தான் உணர்வதாகவும், ஆனால் இன்று அவள் புத்தாடை அணிந்து மகிழ்ச்சியுடன் இருப்பதை பார்த்து தான் எல்லையில்லா ஆனந்தம் அடைவதாகவும் கூறுகின்றார்.
இதில், பிரார்த்தனை செய்துகொண்டிருந்த பலர் தூக்கி வீசப்பட்டு ரத்த வெள்ளத்தில் துடித்தனர்.
இந்த கோர தாக்குதலில் 15 பேர் உயிரிழந்ததாகவும், 42 பேர் காயமடைந்ததாகவும் வெளிநாட்டு செய்திகள் தெரிவிக்கின்றன.
எனவே, இந்த தாக்குதலையும் அவர்கள் நடத்தியிருக்கலாம் என சந்தேகிக்கப்படுகிறது.
இதில் 10-க்கும் மேற்பட்டோர் காயமடைந்ததாக தமிழக செய்திகள் தெரிவிக்கின்றன.
அப்போது அதிலிருந்து ரசாயன திரவங்கள் கொப்பளித்ததாகவும் கூறப்பட்டது.
தகவலறிந்து சம்பவ இடத்துக்கு விரைந்த பொலிஸார், காயமடைந்த 10 பேரை மீட்டு மருத்துவமனையில் சேர்த்துள்ளனர்.
இது சூரிய மண்டலத்துக்கு அப்பால் உள்ளது.
இந்த கிரகத்தில் உயிரினங்கள் வாழ முடியுமா? என்பது பற்றிய ஆய்வு நடக்கிறது.
சிரிய பொதுமக்களுக்கு எதிராக இரசாயனத் தாக்குதல்  பிரயோகிக்கப்பட்டமை காட்டுமிராண்டித் தனமானதுடன், சட்ட விரோதமானது எனவும் அவர் குறிப்பிட்டுள்ளார்.
இந்த நிலையில் விமல் வீரவன்ச, ஐக்கிய தேசிய கட்சியுடன் நட்புறவை பேணுவதாக கூறுகின்றனர்.
இந்தச் சம்பவங்கள் நேற்று இடம்பெற்றதாக காவல்துறையினர் தெரிவித்துள்ளனர்.
இந்தநிலையில், மதுபோதையில் வாகன செலுத்துபவர்களை அடையாளம் காண்பது தொடர்பில் காவற்துறையினர் முகம் கொடுக்கின்ற இன்னல்களை கருத்தில் கொண்டு குறித்த பலூன்கள் விநியோகிக்கப்படவுள்ளன.
கொழும்பு மாநாகர சபைக்குள் மிருக மருத்துவ அதிகாரிகள் 10 பேர் உள்ளனர்.
இதேவேளை, குறித்த பேருந்து ஏற்கனவே பல விபத்துக்களுக்கு முகம் கொடுத்துள்ளதாகவும் இந்த விபத்துக்களினால் ஏற்கனவே ஒருவர் மரணமடைந்துள்ளதாகவும் பொதுமக்கள் குற்றம் சுமத்தியுள்ளனர்.
மட்டக்களப்பு - மயிலம்பாவெளி விபுலானந்தா வித்தியாலயத்தில் நேற்று இடம்பெற்ற நிகழ்வில் கலந்து கொண்டு உரையாற்றிய போதே அவர் இதனை குறிப்பிட்டுள்ளார்.
மட்டக்களப்பு தேற்றாத்தீவு கிராமத்தில் இன்று இடம்பெற்ற நிகழ்வில் கலந்து கொண்டு உரையாற்றி தமிழ் தேசிய கூட்டமைப்பின் நாடாளுமன்ற உறுப்பினர் ஞானமுத்து சிறிநேசன் இந்த கோரிக்கையை விடுத்தார்.
இதன்மூலம் அவர்கள் மேலும் உதவிகளை மேற்கொள்ள முன்வருவார்கள் எனவும் ஞானமுத்து சிறிநேசன் குறிப்பிட்டார்.
பிரதமர் ரணில் விக்கிரமசிங்க இந்த மாத இறுதியில் இந்தியா செல்லவுள்ளதாக தெரிவிக்கப்பட்டுள்ளது.
இலங்கை இந்திய பொருளாதார மற்றும் தொழில்நுட்ப உடன்படிக்கையான எட்கா ஒப்பந்தம் தொடர்பான இறுதி தீர்மானம் ஒன்றை எடுக்கும் நோக்கிலேயே பிரதமரின் இந்திய விஜயம் அமைந்துள்ளது.
அங்குணுகொலபெலச பகுதியில் நேற்று இடம்பெற்ற நிகழ்வொன்றில் உரையாற்றிய அவர் இதனைக் குறிப்பிட்டார்.
தங்கொட்டுவ சிங்கக்குளி பிரதேசத்தில் நேற்று இடம்பெற்ற நிகழ்வொன்றில் கலந்து கொண்ட ஜனாதிபதி இதனை தெரிவித்தார்.
பண்டாவளை வாராந்த சந்தையை சுற்றிவுள்ள நடை பாதை வியாபாரிகளிடம் சந்தையின் குத்தகைதாரர், அச்சுறுத்தி சட்டவிரோதமாக பணம் அறவிடுவதாக அந்த வியாபாரிகள் குற்றம்சாட்டியுள்ளனர்.
சந்தை பூமிக்கு வெளியே உள்ள நடை பாதை வியாபாரிகளிடம், சந்தை குத்தகைதாரருக்கு வரியை அறிவிட அனுமதி இல்லை என்பதுடன், அவர் அனுமதி பத்திர நிபந்தனைகளையும் மீறியுள்ளதாக நாடாளுமன்ற உறுப்பினர் சமிந்த விஜயசிறி இதன்போது குற்றம்சாட்டியுள்ளார்.
இது போன்று சம்பவம் இனி இடம்பெற்றால் கடும் நடவடிக்கை எடுக்கப்படும் என காவற்துறையிடம் தெரிவித்த பின்னர் அவர் அங்கிருந்து சென்றுள்ளார்.
தமிழக செய்திகள் இதனைத் தெரிவித்துள்ளன.
இடைத்தேர்தல் வரலாற்றில் இதுவரை இல்லாத அளவுக்கு ஆர்.கே.நகரில் பலமுனை போட்டி ஏற்பட்டுள்ளது.
62 பேர் களத்தில் உள்ளனர்.
இதையடுத்து அங்கு பறக்கும் படையினர் அதிரடி சோதனை நடத்தி பணப்பட்டுவாடாவை தடுக்க பல்வேறு முயற்சிகளை மேற்கொண்டனர்.
இதைத் தொடர்ந்து ஆர்.கே. நகர் தொகுதிக்கான இடைத்தேர்தலை ரத்து செய்வதாக தேர்தல் ஆணையம் அதிகாரப்பூர்வமாக அறிவித்துள்ளது.
trailing Tethys trojan .
trailing Dione trojan .
வணிகத்தில் தொழில்நுட்ப தடைகள் குறித்த ஒப்பந்தம் (TBT) .
உலக வணிக அமைப்பு பற்றிய செய்தித்தாளில் வெளிவந்தன .
ஒப்பந்தக்குறிப்பு, இன்னும் GATT 1994 இன் இதயமாக திகழ்கிறது).
தொடக்க விழா அலுவலகப்பணித் தொகுதி கூட்டம் சிங்கப்பூரில் 1994 ஆண்டில் நடந்தது.
இந்த கூட்டத்தில், முதல் முறையாக விவாதத்திற்கு கொண்டுவந்த நான்கு விவகாரங்களில், மிகையாக மேம்பாடடைந்த நாடுகள் மற்றும் மேம்பாடடைந்த மற்றும் மேம்பட்டு வரும் பொருளாதாரங்களில் கருத்து வேறுபாடுகள் எழுந்தன, அதன் காரணமாக அவை நான்கையும் சுட்டிக்காட்டும் வகையில் அவற்றை "சிங்கப்பூர் விவகாரங்கள்" என அழைத்தனர்.
மேலும் 3% வரையிலான கட்டண வரிகள் விலக்கு அளிக்காததாக இருக்கும்.
அதாவது, வணிக கொள்கைகளுக்கான விளையாட்டுகளுக்கான விதிமுறைகளை இந்த அமைப்பு மேற்கொள்கிறது.
இவ்வாறு உலக வணிக அமைப்பு முறைகள், முன்னறிந்து கொள்ளக்கூடிய தன்மை மற்றும் நிலைத்தன்மைகளை மேம்படுத்தி, மேலும் ஒதுக்கீடு மற்றும் அது போன்ற தடைகளை விதிக்கும் நடைமுறைகளை நீக்கி, இறக்குமதி பொருட்களுக்கு கட்டுப்பாடுகள் இல்லாதவாறு பார்த்துக்கொள்கின்றன.
சில குறிப்பிட்ட சூழ்நிலைகளில், அரசுகளால் வணிகத்தை கட்டுப்படுத்த இயலும்.
நெசவுத்தொழில் கண்காணிப்புக்குழு மற்ற குழுக்களில் இருந்து வேறுபட்டதாக இருந்தாலும், அதுவும் சரக்கு மன்றத்திற்குள் அடங்கியதே.
இந்த அமைப்பிற்கு அதனுடைய தனித் தலைவர் உண்டு மேலும் அது 10 உறுப்பினர்கள் கொண்டது.
பொதுக்குழுவின் அமைப்பின் வழிகாட்டுதலுடன் சேவைகள் புரிவதற்கான குழுமம் செயல் படுகிறது மேலும் அக்குழு சேவைகள் அளிப்பதற்கான வணிகத்திற்கான பொது ஒப்பந்தங்களின் செயல்பாடுகளை கண்காணிப்பது அதன் பொறுப்பாகும் (GATS) இந்த குழுமம் உலக வணிக அமைப்பு உறுப்பினர்கள் எல்லோருக்கும் திறந்து வைத்ததாகும், மேலும் தேவைகளுக்கேற்றபடி துணைக்குழுமங்களையும் ஏற்படுத்திக்கொள்ளலாம்.
நவம்பர் 28, 2007 அன்று பரணிடப்பட்டது.
The End of the Cold War .
Independence Hall Association.
– சமயங்களுக்கான பிரெஞ்சுப் போர்: முதலாம் என்றி [[பாரிசு நகரை அடைந்து, கிளர்ச்சி ஆரம்பித்ததை அடுத்து பிரான்சின் மூன்றாம் என்றி மன்னர் பாரிசில் இருந்து வெளியேறினார்.
படையினர் இறந்தனர்.
settings: update of literature review and evidence synthesis .
(Suppl A):  S75–S82.
"The interrelationship of sexually transmitted diseases and HIV infection: implications for the control of both epidemics in Africa".
Parasitic worms may boost African HIV rates .
AIDS: science and society .
Financial Resources Required to Achieve, Universal Access to HIV Prevention, Treatment Care and Support .
Paradise Found and Lost .
என்பதின் ஊடகங்கள் உள்ளன.
EPIC Pacific Ocean Data Collection Viewable .
on-line collection of observational data .
data Realtime Pacific Ocean El Niño buoy data .
NOAA Ocean Surface Current Analyses .
—Realtime (OSCAR) Near-realtime Pacific Ocean Surface Currents derived from satellite altimeter and scatterometer data .
ஆனால் இராவணன் அதனை ஏற்றுக்கொள்ள மறுத்துவிட்டான்.
அதில் கடற்பஞ்சை நன்கு தோய்த்து ஈசோப்புத் தண்டில் பொருத்தி அதை அவர்கள் அவரது வாயில் வைத்தார்கள்.
குரு சிவப்பு உடை அணிந்திருப்பார்.
அவர் திருப்பணியாளர்களோடு கோவில் பீடத்திற்கு வந்து முகங்குப்புற விழுந்து அமைதியாக இறைவேண்டல் செய்வார்.
தம்மையே மனிதரின் மீட்புக்காகக் கையளித்தார்.
பின்னர் அனைவரும் அமைதியாகப் பிரிந்து செல்வார்கள்.
தவக் காலத்தின் வெள்ளிக் கிழமைகளிலும், அதிலும் சிறப்பாகப் பெரிய வெள்ளிக் கிழமையில் சிலுவைப் பாதைக் கொண்டாட்டம் தனிப் பொருள் வாய்ந்ததாகத் திகழ்கின்றது.
அங்கு சிலுவைப் பாதை நிகழ்த்தியுள்ளார்.
பல்லாயிரக்கணக்கான மக்கள் இந்த வழிபாட்டு நிகழ்ச்சியில் கலந்துகொண்டனர்.
வத்திக்கானின் மறையுரையாளரான தந்தை ரனியேரோ காந்தலமேசா என்பவர் மறையுரை வழங்கினார்.
மேலும், மனிதர்கள் பிற மனிதர்களை விற்பனைப் பொருள் போல நடத்தும் இழிவைச் சுட்டிக்காட்டினார்.
திருத்தந்தை பிரான்சிசு சிலுவைப் பாதையின் இறுதிக்கட்டத்தில் மக்களுக்கு அறிவுரை வழங்கினார்.
அப்போது அவர் "எல்லாராலும் கைவிடப்பட்ட மக்களை நாம் கைவிடலாகாது.
வறுமை, அரசியல் ஒடுக்குமுறை போன்ற காரணங்களால் தம் நாட்டைவிட்டு வேறு நாடுகளுக்குப் பெயர்ந்து செல்ல முனைவோர் பலர் சாவுக்கு உள்ளாகின்றனர்.
சிறைக்கூடங்களில் கைதிகள் இடவசதியோ பிற வசதிகளோ இன்றி அவதிப்படுகிறார்கள்.
அவற்றை அகற்றிட இயேசுவின் சிலுவைச் சாவு மனிதருக்கு ஒரு தூண்டுதலாக அமைய வேண்டும் என்ற சிந்தனை சிலுவைப் பாதை வழிபாட்டின்போது வழங்கப்பட்டது.
, நவாசுதீன் சித்திக் ஆகியோர் முக்கியக் கதாப்பாத்திரத்தில் நடித்துள்ளனர்.
இப்படத்தின் முன்னோட்டக் காட்சிகள் திசம்பர் 12, 2018 அன்று வெளியானது.
இத்திரைப்படத்தின் பாடல்கள் மற்றும் பிண்ணனி இசையமைத்தவர் .
என்பதின் ஊடகங்கள் உள்ளன.
by Al Van Helden .
எதிராக நாடு 1948 இல் விடுதலை பெற்ற பின்னர் நடத்தப்பட்ட முதலாவது நாடு தழுவிய வன்முறை இனக்கலவரம் ஆகும்.
அத்துடன், தமிழர்கள் பெரும்பான்மையாக வாழும் .
பகுதிகளில் சிங்களவர்கள் சிலர் தமிழர்களால் தாக்கப்பட்டனர்.
இவ்வெதிர்ப்பை அடுத்து, பண்டாரநாயக்கா அரசு பண்டா-செல்வா ஒப்பந்தத்தைக் கிழித்தெறிந்தது.
தளத்தை மூடியதை அடுத்து 400 தமிழ்த் தொழிலாளர்கள் பணியிழந்தார்கள்.
இவர்களை சிங்களவர்கள் பெரும்பான்மையாக வாழும் .
சிங்களக் கும்பலகள் அங்கு உருவாகி அங்கு குடியேற வந்த தமிழர்களைத் தாக்கத் தொடங்கியது.
"Emergency '58 : the story of the Ceylon race riots" என்ற நூல் தார்சி வித்தாச்சி என்ற ஊடகவியலாளரால் இந்தக் கலவரங்கள் பற்றி எழுதப்பட்டது.
ஈராக்கிய குர்திஸ்தான் .
12,000 (ஈராக் வசம்) .
கணக்கீட்டு திரவ இயங்குமுறைகள் வழக்கமான சூத்திரங்களுக்கென்றும் கணிப்பொறி மென்பொருள் இசைவாக்கத்திற்கென்றும் பயன்படுத்தப்படும் எளிதாக்கப்பட்ட அனுமானங்கள் பலவற்றோடும் விலக்களிப்பவையாக இருக்கின்றன.
இந்தக் கருவிகள் கடந்த நாற்பது வருடங்களாக விசையாழி வடிவமைப்பில் நிலையான முன்னேற்றங்களுக்கு இட்டுச்செல்பவையாக இருக்கின்றன.
இந்த எண்ணானது ஆற்றல் மற்றும் ஓட்ட விகிதத்திற்கேற்ப விசையாழியின் அதிகபட்ச வேகத்தை விவரிப்பதாக இருக்கிறது.
திட்டவட்டமான வேகம் விசையாழியிலிருந்து தனித்திருப்பதிலிருந்து பெறப்படுகிறது.
அல்லது எரிபொருள் எண்ணெய் அல்லது அணுமின் சக்தியை பயன்படுத்துபவை.
