இதுதொடர்பாக, சுவிட்சர்லாந்து நாட்டின் தலைநகரான ஜெனிவாவில் இயங்கிவரும் ஐக்கிய நாடுகள் சபையின் மனிதநேய நிவாரணப்படையை சேர்ந்த செய்தி தொடர்பாளர் ஜென்ஸ் லாயெர்கே இன்று செய்தியாளர்களுக்கு பேட்டியளிக்கையில், ‘சிரியாவில் உணவு மற்றும் மருத்துவ நிவாரணப் பொருட்களை ஏற்றிச் செல்லும் வாகனங்கள் பாதுகாப்பு கருதி தற்காலிகமாக நிறுத்தி வைக்கப்படும்.
சுவாதி வழக்கில் கைது செய்யப்பட்டு சிறையில் அடைக்கப்பட்டிருந்த ராம்குமார் கடந்த 18ம் திகதி, சமையல் அறைக்கு அருகில் இருந்த மின் கம்பியை உடலில் செலுத்தி தற்கொலை செய்து கொண்டதாக பொலிஸார் தரப்பில் கூறப்பட்டது.
கடந்த வாரம் ராம்குமார் தனியாக இருந்த போது, நான் அவரிடம், கவலைப்படாதே..
எல்லாம் சரியாகி விடும்.. என்று கூறினேன்.
என்றும் அவர் நீதவான், தமிழ்செல்வியிடம் கூறினார்.
ஐக்கிய நாடுகள் சபையின் 71வது கூட்டத்தொடரில் பங்குபற்றும் அரச தலைவர்களுக்காக ஐக்கிய நாடுகள் சபையின் பொதுச் செயலாளரினால் ஒழுங்கு செய்யப்பட்டிருந்த விசேட பகல் போசன விருந்தில் ஜனாதிபதி கௌரவ மைத்ரிபால சிறிசேன அவர்களைச் சந்தித்தபோதே அமெரிக்க ஜனாதிபதி ஒபாமா இதனைத் தெரிவித்தார்.
சம்பவம் தொடர்பில் தற்போதைய நிலையில் சந்தேக நபர் ஒருவரை கைது செய்துள்ளதாக ஆனமடுவ காவற்துறையினர் எமது செய்திப்பிரிவுக்கு தெரிவித்தனர்.
எதிர்வரும் உள்ளுராட்சி மன்ற தேர்தல் தொடர்பாக கலந்துரையாடுவதற்காக அவர்கள் அங்கு வந்துள்ளனர்.
விபத்தில் உயிரிழந்துள்ளவர் மிதி வண்டியில் பயணித்த 73 வயதான அதே பிரதேசத்தை சேர்ந்த நபர் என தெரியவந்துள்ளது.
கடந்த சில தினங்களுக்கு முன்னர் பந்தகிரி பிரதேசத்தில் நெல் திருட்டு தொடர்பில் குறித்த இளைஞர் கைது செய்யப்பட்ட நிலையில் காவல்நிலையத்தில் இருந்து தப்பிச்சென்றிருந்தார்.
நேற்றைய தினம் வவுனியா மாவட்டதிலேயே அதிமான வெப்பநிலையாக 37 பாகை செல்சியஸ் வெப்பநிலை பதிவாகியிருந்தது.
இப்போராட்டத்தை தேசிய மயப்படுத்தியமைக்காகவும் இப்போராட்டத்தின் நியாயத்தை வெளிக்கொணர்ந்தமைக்காகவும் மதிப்பிற்குரிய ஊடகவியலாளர்களையும் ஊடக நிறுவனங்களையும் நாங்கள் நன்றியுடன் நினைவு கூருகின்றோம்.
நம்பியிருந்த அனைத்து அரசியல் தரப்புக்களும் தமது கதவுகளை இறுக்கமூடிய பின்னர் வேறு வழிகளின்றி வீதியிலே இறங்கிப் போராட வேண்டிய நிர்ப்பந்தம் எம் மக்கள் மீது திணிக்கப்பட்டது.
இவ்வனல்மின் நிலையம் அமைப்பதற்காகச் செய்யப்பட்டிருந்த சுற்றுச் சூழல் தாக்க ஆய்வு அறிக்கையில் காணப்படும் அனைத்து முரண்பாடுகளையும் அதன் தவறுகளையும் சுட்டிக்காட்டிய இவ்வழக்கில் கடந்த 13ம் திகதி இத்திட்டத்திற்குப் பொறுப்பான அமைச்சு சம்பூர் நிலக்கரி அனல்மின் நிலையத்திட்டத்தை உத்தியோக பூர்வமாக கைவிடுவதாக அறிவித்தது.
இப்போராட்டம் முழுவதிலும் எம்முடன் இணைந்திருந்து எம்மை வலுவூட்டி நம்பிக்கையூட்டியதோடு எமது போராட்டத்தை திருக்கோணமலையைத் தாண்டி வெளியே கொண்டு சென்று யாழ்ப்பாணம், கொழும்பு , வவுனியா எங்கிலும் பேசு பொருளாக்கிய சமூக நீதிக்கான வெகுஜன அமைப்பை நாங்கள் மிக நன்றியுடன் நினைவு கூருகின்றோம்.
அவா்களுக்கும் எமது நன்றிகளை இத்தால் தொிவிக்கின்றோம்.அடுத்து மூதுாரிலும் தோப்பூரிலும் மக்கள் போராட்டங்களை ஒருங்கமைத்து காத்திரமான பங்களிப்பைச் வழங்கிய மூதுார் பசுமைக் குழு மற்றும் உலமா சபையினரை நாம் நன்றியுடன் நினைவு கூருகின்றோம்.மேலும் மூதுார் பிரதேச பெண்கள் அபிவிருத்தி வலையமைப்பானது அனல் மின் நிலையத்திற்கு எதிராக 607 பேருடைய கையெழுத்துக்களை சேகாித்து ஜனாதிபதி அவா்களுக்கு மகஜா் ஒன்றை சமா்ப்பித்திருந்தது.
அத்துடன் திருகோணமலை மாவட்ட பெண்கள் வலையமைப்பும் எம்முடன் இது சம்மந்தமான பல்வேறுபட்ட பாிந்துரை நடவடிக்கைகளில் முன்னின்றது.
அவா்களுக்கும் எமது இதயபூர்வமான நன்றிகளை தொிவிக்கின்றோம்.தொடா்ந்து கள ஆய்கவுளை மேற்கொண்டு இப்போராட்டத்தை வேறு முனையில் நகர்த்திச் செல்லவென கிழக்கின் மக்கள் குரல் என்கிற அமைப்பொன்றை நிறுவி அதனுாடாக ஆதரவை வழங்கிய மக்கள் விடுதலை முன்னணி அமைப்பையும், மற்றும் தார்மீக ஆதரவை வழங்கியமைக்காகவும் எம்முடன் போராட்டங்களில் கலந்து கொண்டமைக்காகவும் முஸ்லிம் காங்கிரஸ் மற்றும் தமிழ் தேசிய கூட்டமைப்பு மாகாண சபை உறுப்பினர்களையும் ஏனைய அரசியல் சக்திகளையும் நாம் நன்றியுடன் நினைவு கூருகின்றோம்.
நாங்கள் அபிவிருத்தி செயற்பாடுகளுக்கு எதிரானவர்கள் அல்ல.
நிலக்கரி அனல்மின் நிலையத்தை கைவிட்டமைக்காக அரசுக்கு நன்றி கூறும் இத்தருணத்தில் எம்மக்களின் வாழ்விடங்களையும் வயற்காணிகளையும் நீர்பாய்ச்சற் குளங்களையும் மீளக் கையளிப்பதற்கான நடவடிக்கைகளை விரைந்து மேற்கொண்டு , யுத்த த்தின் பின்பான நல்லிணக்கத்தை நிலைபேறாக்கி, மக்களும் அனுபவிக்க வழிவகை செய்யுமாறு கேட்டுக்கொள்கின்றோம்.
நிதி அமைச்சர் , அனர்த்த முகாமைத்துவ அமைச்சர் , கொழும்பு மாவட்ட செயலாளர் , நகர அபிவிருத்தி அதிகார சபையின் பிரதிநிதிகள் மற்றும் பாதிக்கப்பட்ட சாலாவ மக்கள் ஆகியோர் கலந்து கொண்ட பேச்சுவார்தையொன்று இன்று நிதி அமைச்சில் இடம்பெற்றது.
அது , ஜனாதிபதி செயலாளருடன் பேச்சுவார்த்தை மேற்கொண்டு நிரந்தர தீர்வொன்றை பெற்றுத்தருவதாக ஜனாதிபதி அலுவலகத்தின் மேலதிக செயலாளர் சுனந்த காரியப்பெரும வழங்கிய கடிதம் மூலமான வாக்குறுதியை தொடர்ந்தாகும்.
இந்த சந்திப்பின் போதே ஜனாதிபதி இந்த வலியுறுத்தலை விடுத்துள்ளார்.
இதற்கு இந்திய மத்திய அரசாங்கத்தின் உதவியும் தேவைப்படுவதாக ஜனாதிபதி மைத்திரிபால சிறிசேன குறிப்பிட்டார்.
கிளிநொச்சி பொதுச்சந்தையில் ஏற்பட்ட தீ விபத்து காரணமாக 125 கடைகள் பாதிக்கப்பட்டுள்ளன.
நேற்று மதியம் 1 மணியளவில் ஏற்பட்ட இந்த தீப்பரவல் தொடர்பில் பிரதேசவாசிகளால் வேளான்குளம் இராணுவ முகாமுக்கு அறிவிக்கப்பட்டதை தொடர்ந்து அதனை கட்டுப்படுத்த நடவடிக்கை எடுக்கப்பட்டது.
இதுபற்றி இம்ரான் கேஜி ஹல்லி பொலிசில் புகார் செய்தார்.
எங்கள் 7 பேரிடமும் பறித்த கோடிக்கணக்கான பணத்தை கொண்டு அவர் சொகுசு வாழ்க்கை வாழ்ந்து வருகிறார்.
இதுகுறித்து நான் கேட்டபோது என்னை தாக்கினார்.
எனவே அவர் மீது கொலை முயற்சி வழக்கு, மோசடி வழக்குப்பதிவு செய்து நடவடிக்கை எடுக்க வேண்டும்.
இவ்வாறு இம்ரான் அந்த மனுவில் கூறி இருந்தார்.
90 வீதத்திற்கும் மேலாக சைவசமயத்தைப் பின்பற்றும் மாணவர்கள் கல்வி கற்கும் பாடசாலையில், அவர்கள் வழிபடுவதற்கு வழிபாட்டிடம் இல்லை எனவும் சுட்டிக்காட்டப்பட்டுள்ளது.
ஆசிரியர் பயிற்சியின் போது பயிற்றப்பட்ட ஒழுக்கத்தை பாதுகாப்பதற்கான நடைமுறை செயற்பாடொன்றாக இது செயற்படுத்தப் படுவதாக அப்பாடசாலையின் ஆசிரியர்கள் தெரிவித்திருந்தனர்.
அதனை தொடர்ந்து ஊடகங்களுக்கு கருத்து தெரிவித்த உதய கம்மன்பில , டிசம்பர் மாதம் 31ம் திகதிக்கு முன்னர் உள்ளூராட்சி தேர்தலை நடத்த முடியாவிடின் , தனது பதவியில் இருந்து விலகுவதாக தேர்தல் ஆணையாளர் தெரிவித்தாக அவர் கம்மன்பில தெரிவித்திருந்தார்.
கொழும்பு பொது நூலக கேட்போர் கூடத்தில் இடம்பெற்ற கருத்தரங்கொன்றில் கலந்து கொண்டு உரையாற்றிய போது அவர் இதனை தெரிவித்திருந்தார்.
'நச்சுத்தன்மையற்ற நாடு' என்ற தொனிப்பொருளின் கீழ் கொழும்பில் நேற்று இடம்பெற்ற கலந்துரையாடலில் பங்கேற்று உரையாற்றிய போதே அவர் இதனை குறிப்பிட்டுள்ளார்.
இந்த அரசாங்கம் ஆட்சி அமைக்க பாரிய பங்களிப்பு தமது கட்சியுடன் வழங்கியதாக தெரிவித்த நாடாளுமன்ற உறுப்பினர் அத்துரலிய ரத்தன தேரர், அந்த இரசாயன பசளைகளை ஒருபோதும் அனுமதிக்க போவதில்லை என குறிப்பிட்டுள்ளார்.
இரகசிய காவற்துறையினர் நீதிமன்றத்தில் இதனை தெரிவித்தனர்.
இவ்வாறு கொண்டு செல்லப்பட்ட எலும்புகளில் வசீம் தாஜூதீனின் எலும்பு பகுதி காணப்பட்டதா? என்பது தொடர்பில் விசாரணைகள் இடம்பெற்று வருவதாக இரகசிய காவற்துறையினர் நீதிமன்றத்தில் தெரிவித்தனர்.
தற்போது காணாமல் போனதாக கூறப்படும் எலும்புகள் அவையே என, சம்பவம் தொடர்பில் விசாரணைகளை மேற்கொண்டு வரும் உப காவற்துறை பரிசோதகர் ஒருவர் எமது செய்தி சேவைக்கு குறிப்பிட்டார்.
இதற்கமைய அந்த குழு ஆய்வுகளை மேற்கொள்ளவுள்ளதாக அவர் குறிப்பிட்டுள்ளார்.
இந்தநிலையில் மத்திய மாகாணத்தில் தமிழ் பட்டதாரிகள் இல்லாத பட்சத்தில் வடக்கு கிழக்கில் இருந்து பட்டதாரிகளை இணைத்துகொள்வது தொடர்பில் மாகாண சபையில், அமைச்சரவை பத்திரம் தாக்கல் செய்யப்பட்டிப்பதாக அவர் தெரிவித்தார்.
இந்த விடயம் தொடர்பில் வடக்கு மாகாண கல்வி அமைச்சர் குருகுல ராசாவிடம் எமது செய்தி பிரிவு வினவியது.
திறந்த அறிவிப்பு ஒன்றின் மூலம் வடமாகாண பட்டதாரிகளை மத்திய மாகாணத்தில் இணைத்து கொள்வதில் எந்த பிரச்சினையும் இல்லை என அவர் குறிப்பிட்டார்.
இதனிடையே இதுதொடர்பில் கிழக்கு மாகாண கல்வி அமைச்சர் சீ தண்டாயுதபாணியிடம் எமது செய்தி சேவை வினவ முற்பட்ட போது, அவர் முக்கிய சந்திப்பில் இருப்பதாகவும் தாமதித்து தொடர்பு கொள்ளுமாறும் அவர் சார்பில் தெரிவிக்கப்பட்டது.
இதனையடுத்து பாடசாலைகள் மற்றும் வர்த்தக நிலையங்கள் என்பன மூடப்பட்டுள்ளதாக இந்திய ஊடகங்கள் செய்தி வெளியிட்டுள்ளன.
இதனையடுத்து குறித்த பிரதேசத்தில் காவற்துறை பாதுகாப்பு பலப்படுத்தப்பட்டுள்ளது.
தீவிரவாதிகள் வசம்முள்ள சிரியாவின் அலெப்போ நகரின் தென்கிழக்கு பகுதியில் உள்ள கான் தவுமான் பகுதியிலேயே குறித்த தாக்குதல் சம்பவம் இடம்பெற்றுள்ளது.
இந்த வானூர்த்தி தாக்குதலை நடத்தியது யார்? என்பது தொடர்பில் தெளிவாக தெரியவராத நிலையில், ரஷ்யா அல்லது சிரியா வான்படைகளே இந்த தாக்குதலில் ஈடுபட்டிருக்கலாம் என சந்தேகம் வெளியிடப்பட்டுள்ளதாக சர்வதேச ஊடகங்கள் தெரிவித்துள்ளன.
இதுவே அரசாங்கத்தின் இலக்காக இருக்கிறது என்று அவர் கூறியுள்ளார்.
இதேவேளை, போதைப் பொருள் ஒழிப்பு தொடர்பில் சர்வதேச மற்றும் தேசிய மட்ட நடவடிக்கைகள் எடுக்கப்பட வேண்டும் என்று அவர் கூறியுள்ளார்.
போதைப் பொருள் பிரச்சினை தற்போது பாரிய பிரச்சினையாக  மாற்றம் பெற்றுள்ளது என்றும் அவர் சுட்டிக்காட்டியுள்ளார்.
மேலும் இதற்கு சர்வதேசத்தின் ஒத்துழைப்பையும் அவர் கோரியுள்ளார்.
தங்களின் விடுதலையை வலியுறுத்தியும், தங்களது வழக்கு விசாரணைகளை தமிழ் பிரதேசங்களில் உள்ள நீதிமன்றங்களில் முன்னெடுக்குமாறு கோரியும் இந்த போராட்டம் முன்னெடுக்கப்படுகிறது.
இதற்கு முன்னரும் அரசியல் கைதிகள் பல்வேறு தடவைகள் உணவுத் தவிர்ப்பு போராட்த்தை முன்னெடுத்துள்ளனர்.
இதன்போது அரசாங்கத்தினாலும், தமிழ் தேசிய கூட்டமைப்பினால் உறுதிமொழிகள் வழங்கப்பட்டமைக்கு இணங்க அவர்களின் போராட்டங்கள் கைவிடப்பட்டிருந்தன.
எனினும் அவர்களுக்கு வழங்கப்பட்ட உறுதிமொழிகள் நிறைவேற்றப்படுவதில் தாமதம் ஏற்பட்டுள்ளமையாலேயே மீண்டும் அவர்கள் உணவுத் தவிர்ப்பு போராட்டத்தை ஆரம்பித்துள்ளனர்.
காவற்துறையினர் இதனைத் தெரிவித்துள்ளனர்.
நாடாளுமன்ற கட்டிடத் தொகுதியில் இடம்பெற்ற நிகழ்வொன்றில் வைத்து அவர் இதனைக் கூறியுள்ளார்.
யுத்தம் நிறைவு பெற்றவுடன் பாரிய ஒடுக்குமுறை ஆட்சி இடம்பெற்றது.
ஊழல்கள் தொடர்பில் நாடாளுமன்றத்தில் உரையாட தற்போது வாய்ப்பு ஏற்பட்டிருக்கிறது.
கடந்த தினம் காவற்துறை அதிகாரிகளால் அவர் சுட்டுக் கொல்லப்பட்டார்.
40 வயதான குறித்த நபர், ஆயுதங்கள் இன்றி கைகளை உயர்த்தியபடி பாதையில் நடந்து செல்வதும், அவருக்கு பின்னால் சென்ற காவற்துறை அதிகாரிகள் அவரை சுட்டுக் கொல்வதுமான காணொளி தற்போது வெளியாகி இருக்கிறது.
